task_id,run_id,iteration,severity,target_artifact,issue_summary,proposed_action,acceptance_check,status,human_decision,notes
TRAIN-20260603_TEXTONLY_STAGE_API_CODEX-TASK-001,TRAIN-20260603_TEXTONLY_STAGE_API_CODEX,1,major,16_learning/agent_runs/TRAIN-20260603_TEXTONLY_STAGE_API_CODEX/workspace/09_paper/full_draft.md,our_count=2; benchmark_average=4.00; threshold=4.00,"Expand the paper structure so problem analysis, model building, results, validation, and conclusion are all visible.",Draft contains at least five clear sections or subsections.,open,,from TRAIN-20260603_TEXTONLY_STAGE_API_CODEX-GAP-001
TRAIN-20260603_TEXTONLY_STAGE_API_CODEX-TASK-002,TRAIN-20260603_TEXTONLY_STAGE_API_CODEX,1,major,16_learning/agent_runs/TRAIN-20260603_TEXTONLY_STAGE_API_CODEX/workspace/09_paper/full_draft.md,our_count=0; benchmark_average=2.00; threshold=2.00,Add result-bound figures and register them in the sandbox figure contract before citing them.,Figure mentions are backed by existing figure files and figure_contract rows.,open,,from TRAIN-20260603_TEXTONLY_STAGE_API_CODEX-GAP-002
TRAIN-20260603_TEXTONLY_STAGE_API_CODEX-TASK-003,TRAIN-20260603_TEXTONLY_STAGE_API_CODEX,1,major,16_learning/agent_runs/TRAIN-20260603_TEXTONLY_STAGE_API_CODEX/workspace/09_paper/full_draft.md,our_count=0; benchmark_average=13.40; threshold=13.40,"Add validation, sensitivity, robustness, or error analysis tied to model outputs.",Validation section cites frozen result rows or reproducible code outputs.,open,,from TRAIN-20260603_TEXTONLY_STAGE_API_CODEX-GAP-003
TRAIN-20260603_TEXTONLY_STAGE_API_CODEX-TASK-004,TRAIN-20260603_TEXTONLY_STAGE_API_CODEX,1,minor,16_learning/agent_runs/TRAIN-20260603_TEXTONLY_STAGE_API_CODEX/workspace/09_paper/full_draft.md,our_count=0; benchmark_average=1.00; threshold=1.00,Make the core model equations and variable definitions explicit.,Important formulas have formula_contract rows and symbol definitions.,open,,from TRAIN-20260603_TEXTONLY_STAGE_API_CODEX-GAP-004
TRAIN-20260603_TEXTONLY_STAGE_API_CODEX-TASK-005,TRAIN-20260603_TEXTONLY_STAGE_API_CODEX,1,fail,workspace/14_contracts,claim_rows=0; result_rows=4,Populate sandbox result_contract and claim_evidence_map before treating draft claims as paper-ready.,Both contract files contain rows supporting major claims and numerical results.,open,,from TRAIN-20260603_TEXTONLY_STAGE_API_CODEX-GAP-900
